{
  "artifacts": [
    {
      "path": ".gitattributes",
      "role": "repository_metadata",
      "sha256": "11ad7efa24975ee4b0c3c3a38ed18737f0658a5f75a0a96787b576a78a023361",
      "size_bytes": 1519,
      "source_url": "https://huggingface.co/deepseek-ai/DeepSeek-V4-Flash-0731/resolve/9e165c30e2704aec5d9d593cce3eebd58bbef1cb/.gitattributes",
      "upstream_objects": [
        {
          "algorithm": "sha1",
          "kind": "git_blob",
          "value": "a6344aac8c09253b3b630fb776ae94478aa0275b"
        }
      ],
      "verification_level": "local_bytes"
    },
    {
      "path": "LICENSE",
      "role": "license",
      "sha256": "f2c6c602815669d292889e5be8c802f2ed950653b77999b1584e8e6aed25d040",
      "size_bytes": 1084,
      "source_url": "https://huggingface.co/deepseek-ai/DeepSeek-V4-Flash-0731/resolve/9e165c30e2704aec5d9d593cce3eebd58bbef1cb/LICENSE",
      "upstream_objects": [
        {
          "algorithm": "sha1",
          "kind": "git_blob",
          "value": "d62e3bef9f054f21b7fc616365850fbf879a99ff"
        }
      ],
      "verification_level": "local_bytes"
    },
    {
      "path": "README.md",
      "role": "model_card",
      "sha256": "3e66a85d35215e658011f0d8ad4fe7d725c4beacb095892ef5aa96f369f2fa20",
      "size_bytes": 6494,
      "source_url": "https://huggingface.co/deepseek-ai/DeepSeek-V4-Flash-0731/resolve/9e165c30e2704aec5d9d593cce3eebd58bbef1cb/README.md",
      "upstream_objects": [
        {
          "algorithm": "sha1",
          "kind": "git_blob",
          "value": "34e35f87a5b9140202fbd804b695208694b62215"
        }
      ],
      "verification_level": "local_bytes"
    },
    {
      "path": "config.json",
      "role": "model_config",
      "sha256": "6c8f3d2d3b48707541b88f32f22ef3f0f8a6b57d8523281e2b8d3cdb0ae9a023",
      "size_bytes": 1888,
      "source_url": "https://huggingface.co/deepseek-ai/DeepSeek-V4-Flash-0731/resolve/9e165c30e2704aec5d9d593cce3eebd58bbef1cb/config.json",
      "upstream_objects": [
        {
          "algorithm": "sha1",
          "kind": "git_blob",
          "value": "5f2da9100036b39e26ebe5ab493c5e8d4004d8a1"
        }
      ],
      "verification_level": "local_bytes"
    },
    {
      "path": "encoding/README.md",
      "role": "encoding_documentation",
      "sha256": "294ed6493ebfe5a487f172154d60c494899997fed8806fdd3352dd8e3c33f9de",
      "size_bytes": 9168,
      "source_url": "https://huggingface.co/deepseek-ai/DeepSeek-V4-Flash-0731/resolve/9e165c30e2704aec5d9d593cce3eebd58bbef1cb/encoding/README.md",
      "upstream_objects": [
        {
          "algorithm": "sha1",
          "kind": "git_blob",
          "value": "78d93a8a4dd24378356523992dea6517844657e1"
        }
      ],
      "verification_level": "local_bytes"
    },
    {
      "path": "encoding/encoding_dsv4.py",
      "role": "encoding_reference_code",
      "sha256": "abc0d26120250dda0ae077dc64aa28836026e61e970854aaeb792445e6a0dde6",
      "size_bytes": 29001,
      "source_url": "https://huggingface.co/deepseek-ai/DeepSeek-V4-Flash-0731/resolve/9e165c30e2704aec5d9d593cce3eebd58bbef1cb/encoding/encoding_dsv4.py",
      "upstream_objects": [
        {
          "algorithm": "sha1",
          "kind": "git_blob",
          "value": "66f2d30ece5a93e08fbab47aeb9f3541830930ef"
        }
      ],
      "verification_level": "local_bytes"
    },
    {
      "path": "encoding/test_encoding_dsv4.py",
      "role": "encoding_test",
      "sha256": "c2bc54c4c934f5c64096bd9c555efa7d1ddf179c1eff58f01ceb2dcd60adcf28",
      "size_bytes": 3741,
      "source_url": "https://huggingface.co/deepseek-ai/DeepSeek-V4-Flash-0731/resolve/9e165c30e2704aec5d9d593cce3eebd58bbef1cb/encoding/test_encoding_dsv4.py",
      "upstream_objects": [
        {
          "algorithm": "sha1",
          "kind": "git_blob",
          "value": "1c896e797e3f0cc6a95f6dd51079df1e6ba1887e"
        }
      ],
      "verification_level": "local_bytes"
    },
    {
      "path": "encoding/tests/test_input_1.json",
      "role": "encoding_test_input",
      "sha256": "10e0c074c977c3a80daab758af28219c6b1c2bd7f3f5cf2890c84b361cc32897",
      "size_bytes": 2748,
      "source_url": "https://huggingface.co/deepseek-ai/DeepSeek-V4-Flash-0731/resolve/9e165c30e2704aec5d9d593cce3eebd58bbef1cb/encoding/tests/test_input_1.json",
      "upstream_objects": [
        {
          "algorithm": "sha1",
          "kind": "git_blob",
          "value": "d423b221fa88153a826f7724cc938e0703858c21"
        }
      ],
      "verification_level": "local_bytes"
    },
    {
      "path": "encoding/tests/test_input_2.json",
      "role": "encoding_test_input",
      "sha256": "c44ae0db20fafff38a6021e8068d7ed6e28605d76cafd20be80b03398509f447",
      "size_bytes": 526,
      "source_url": "https://huggingface.co/deepseek-ai/DeepSeek-V4-Flash-0731/resolve/9e165c30e2704aec5d9d593cce3eebd58bbef1cb/encoding/tests/test_input_2.json",
      "upstream_objects": [
        {
          "algorithm": "sha1",
          "kind": "git_blob",
          "value": "13b3454a902deecafe75644b41cd6b3e4a0e5354"
        }
      ],
      "verification_level": "local_bytes"
    },
    {
      "path": "encoding/tests/test_input_3.json",
      "role": "encoding_test_input",
      "sha256": "37bf8ef95e0411ea5f411be0b02fbafec7363438b6ccefddca0c52ec9aeaf69a",
      "size_bytes": 4546,
      "source_url": "https://huggingface.co/deepseek-ai/DeepSeek-V4-Flash-0731/resolve/9e165c30e2704aec5d9d593cce3eebd58bbef1cb/encoding/tests/test_input_3.json",
      "upstream_objects": [
        {
          "algorithm": "sha1",
          "kind": "git_blob",
          "value": "10034844edfc33b954ae530f35590132cdf4a342"
        }
      ],
      "verification_level": "local_bytes"
    },
    {
      "path": "encoding/tests/test_input_4.json",
      "role": "encoding_test_input",
      "sha256": "c45bbd0a1b7a2f75033d8db4ba74ee5b7653bd01114045a52f79d3b387663465",
      "size_bytes": 2730,
      "source_url": "https://huggingface.co/deepseek-ai/DeepSeek-V4-Flash-0731/resolve/9e165c30e2704aec5d9d593cce3eebd58bbef1cb/encoding/tests/test_input_4.json",
      "upstream_objects": [
        {
          "algorithm": "sha1",
          "kind": "git_blob",
          "value": "d5e0791dd6997a2007f3aa917919a680521bcd51"
        }
      ],
      "verification_level": "local_bytes"
    },
    {
      "path": "encoding/tests/test_output_1.txt",
      "role": "encoding_test_output",
      "sha256": "9b366d9d2eac842a6e890594aac0b58648e5623717202b33497afadf03e26540",
      "size_bytes": 2390,
      "source_url": "https://huggingface.co/deepseek-ai/DeepSeek-V4-Flash-0731/resolve/9e165c30e2704aec5d9d593cce3eebd58bbef1cb/encoding/tests/test_output_1.txt",
      "upstream_objects": [
        {
          "algorithm": "sha1",
          "kind": "git_blob",
          "value": "7e3c9bd5a394617f02d76384d613d991e60d48bd"
        }
      ],
      "verification_level": "local_bytes"
    },
    {
      "path": "encoding/tests/test_output_2.txt",
      "role": "encoding_test_output",
      "sha256": "ca66b01a1ac3a204bb032c928fb607d4877171e998a50f7f89f39fa821b75665",
      "size_bytes": 342,
      "source_url": "https://huggingface.co/deepseek-ai/DeepSeek-V4-Flash-0731/resolve/9e165c30e2704aec5d9d593cce3eebd58bbef1cb/encoding/tests/test_output_2.txt",
      "upstream_objects": [
        {
          "algorithm": "sha1",
          "kind": "git_blob",
          "value": "fc397ef549728ad6083a577010192e62f3edeee4"
        }
      ],
      "verification_level": "local_bytes"
    },
    {
      "path": "encoding/tests/test_output_3.txt",
      "role": "encoding_test_output",
      "sha256": "b3b1cd8748b7b90d3c6be6da3f786f12e4d70be073bd445ea162dfad4dc01a64",
      "size_bytes": 3313,
      "source_url": "https://huggingface.co/deepseek-ai/DeepSeek-V4-Flash-0731/resolve/9e165c30e2704aec5d9d593cce3eebd58bbef1cb/encoding/tests/test_output_3.txt",
      "upstream_objects": [
        {
          "algorithm": "sha1",
          "kind": "git_blob",
          "value": "edee563300d49b0c46af1429a1e1b00b15610a72"
        }
      ],
      "verification_level": "local_bytes"
    },
    {
      "path": "encoding/tests/test_output_4.txt",
      "role": "encoding_test_output",
      "sha256": "60e1643840ba9e4aeede450feb7b0498fa66ee24e4a939d48855ce04ec6fc375",
      "size_bytes": 2552,
      "source_url": "https://huggingface.co/deepseek-ai/DeepSeek-V4-Flash-0731/resolve/9e165c30e2704aec5d9d593cce3eebd58bbef1cb/encoding/tests/test_output_4.txt",
      "upstream_objects": [
        {
          "algorithm": "sha1",
          "kind": "git_blob",
          "value": "d30bd5d06cf39fe110bc4406292fccde0444c120"
        }
      ],
      "verification_level": "local_bytes"
    },
    {
      "path": "generation_config.json",
      "role": "generation_config",
      "sha256": "5fccff80f55a4d455bbe516bdd552edf3e9623df95e99fbf2a3c3389fdf91af0",
      "size_bytes": 170,
      "source_url": "https://huggingface.co/deepseek-ai/DeepSeek-V4-Flash-0731/resolve/9e165c30e2704aec5d9d593cce3eebd58bbef1cb/generation_config.json",
      "upstream_objects": [
        {
          "algorithm": "sha1",
          "kind": "git_blob",
          "value": "c56a8c5bf06ff7740b6a33ee67b38b6237a230b1"
        }
      ],
      "verification_level": "local_bytes"
    },
    {
      "path": "inference/README.md",
      "role": "inference_documentation",
      "sha256": "b9fe8027f91f2160b46582b61eaaf7b9873b3da36ee9f98bc76a900e7c1fed94",
      "size_bytes": 951,
      "source_url": "https://huggingface.co/deepseek-ai/DeepSeek-V4-Flash-0731/resolve/9e165c30e2704aec5d9d593cce3eebd58bbef1cb/inference/README.md",
      "upstream_objects": [
        {
          "algorithm": "sha1",
          "kind": "git_blob",
          "value": "e11577229e5e5b6f82f687f7ed755096b3edd8d6"
        }
      ],
      "verification_level": "local_bytes"
    },
    {
      "path": "inference/config.json",
      "role": "inference_config",